{
  "schema_version": "1.0",
  "skill": "deep-work",
  "title": "AMI Factory Deep Work Portal",
  "root": "page",
  "meta": {
    "watermark": "sample \u00b7 deep-work \u00b7 deterministic JSON renderer"
  },
  "elements": {
    "page": {
      "type": "Page",
      "props": {
        "mode": "single-page",
        "category": "aws",
        "topic": "ami-factory",
        "environment": "dev"
      },
      "children": [
        "hero",
        "snapshots",
        "map",
        "timeline",
        "glossary",
        "quiz",
        "commands"
      ]
    },
    "hero": {
      "type": "Hero",
      "props": {
        "title": "AMI Factory Deep Work Portal",
        "subtitle": "Durable learning artifact generated from a compact JSON spec.",
        "thesis": "Agents choose approved components; deterministic code renders the dashboard.",
        "chips": [
          "DD",
          "offline",
          "portal-ready"
        ]
      },
      "children": []
    },
    "snapshots": {
      "type": "SnapshotCards",
      "props": {
        "title": "30-second View",
        "cards": [
          {
            "label": "Pattern",
            "value": "JSON spec \u2192 HTML",
            "status": "success",
            "icon": "\ud83e\udde9"
          },
          {
            "label": "Benefit",
            "value": "lower token drift",
            "status": "info",
            "icon": "\ud83c\udfaf"
          },
          {
            "label": "Scope",
            "value": "reporting only",
            "status": "warning",
            "icon": "\ud83d\udee1\ufe0f"
          }
        ]
      },
      "children": []
    },
    "map": {
      "type": "ConceptMap",
      "props": {
        "title": "Concept Map",
        "nodes": [
          {
            "id": "catalog",
            "label": "Catalog",
            "lane": "Control"
          },
          {
            "id": "spec",
            "label": "Spec",
            "lane": "AI"
          },
          {
            "id": "renderer",
            "label": "Renderer",
            "lane": "Code"
          },
          {
            "id": "html",
            "label": "Offline HTML",
            "lane": "Output"
          }
        ],
        "edges": [
          [
            "catalog",
            "spec"
          ],
          [
            "spec",
            "renderer"
          ],
          [
            "renderer",
            "html"
          ]
        ]
      },
      "children": []
    },
    "timeline": {
      "type": "Timeline",
      "props": {
        "title": "Workflow",
        "events": [
          {
            "when": "1",
            "label": "Write spec",
            "detail": "AI emits only JSON."
          },
          {
            "when": "2",
            "label": "Validate",
            "detail": "Catalog and safety gates run."
          },
          {
            "when": "3",
            "label": "Render",
            "detail": "Python renderer creates stable HTML."
          }
        ]
      },
      "children": []
    },
    "glossary": {
      "type": "Glossary",
      "props": {
        "terms": [
          {
            "term": "Catalog",
            "definition": "Allowed components and props."
          },
          {
            "term": "Registry",
            "definition": "Renderer implementation for each component."
          },
          {
            "term": "Spec",
            "definition": "JSON page description generated by AI."
          }
        ]
      },
      "children": []
    },
    "quiz": {
      "type": "Quiz",
      "props": {
        "questions": [
          {
            "question": "What should AI generate?",
            "answer": "A compact JSON spec, not full HTML/CSS."
          },
          {
            "question": "What creates determinism?",
            "answer": "Fixed catalog, fixed validator, fixed renderer, fixed design tokens."
          }
        ]
      },
      "children": []
    },
    "commands": {
      "type": "CommandBlocks",
      "props": {
        "commands": [
          {
            "label": "Validate spec",
            "command": "python3 scripts/validate_spec.py examples/sample.spec.json"
          },
          {
            "label": "Render HTML",
            "command": "python3 scripts/render_html_from_spec.py examples/sample.spec.json /tmp/deep-work-sample.html"
          }
        ]
      },
      "children": []
    }
  }
}
